,Franchise Name ,Franchise Owner Name,State,District,Village,Address,Contact No,Lead Source,Converted by,Onboarding Month,Date of Conversion,Franchise Amount Paid (in Rs.),Invoice  Amount without GST Paid (in Rs.),Transaction ID/Cheque No,Joining Kit Status - Given (Y/N),Branding Installation Status (Y/N),GST Invoice Status(Y/N),Revenue Punched (in Rs.),Revenue Collected till Date (in Rs.),Sales Commssions ( in Rs.),Remarks (if any),INVOICES - (Y / N),Aadhar Card,Pan Card ,Bank Details,PAYMENT RECEIPT- (Y/N),DOCUMENT,Branding          Y/N,Demo Unit,CALENDER ADDRESS,Demo Given by Dinbandhu,Demo Given By Dinbandhu Date ,Demo Given Of Amount (In Rs.)
1,Jiddh Solar Enterprises,Mr.Kondiba Anuse,MH,Solapur,"Salgar BK,Mangalwedha","At Post-salger bk, Ta-mangalwadh, Dist-solapur, Pin-413319",9465952965,Pravin,Pravin,Apr'22,11/04/2022,25000,20500,Cash,Y,Y,Y,25000,25000,2050,Payment Clear,Y,Y,Y,Y,,,,Cattel Feed,DONE,,,
2,Renewable Park,Mr.Kaznooru Ashok Kumar Reddy,AP,Kurnool,Peerusaheb Peta,"9-35,Peerusaheb Peta
Village, Midthur Mandal,
Nandyal District 
pin code-518405",8555939031,Teja/Mahesh,Teja/Mahesh/Arjun,May22,23/05/2022,25000,20500,UPI,N,Y,Y,25000,25000,2050,Payment Clear,Y,,,,,,,,,,,
3,Shankar Krupa Solar product and electric tractor agency,Mr.Avinash Chandrao Vaidya,MH,Nanded,Bhokar Phata,"Bhokar Phata, Post Dabhad, Tal. Ardhapur, Dist. Nanded, Pin code - 431745",9834664833,Tushar/Arjun,Tushar/Arjun,May23,27/05/2022,40000,32800,UPI,Y,Y,Y,40000,40000,3280,Payment Clear,Y,,,,Y,,Y,Solar Torch/ Natural Hydrogel,DONE,"AVDDSF24 Solar Pedestal Fan,
AVGG Organic Bioactive Fertilizer,
AVMK Sakal Samriddhi Olpn 1 L(10-50L),
AVOC Natural Immunity Cattle Supplement Rakshak 2 Kg ",19 Sep 2024,6609
4,Kissan Khad Bheej Bhandar,Mr Guman Singh Rathore,RJ,Jaipur,Daulatpura,"Daulatpura, Amer ,
Jaipur 303805",9079288408,Arjun ,Arjun,July,13/07/2022,40000,32800,Cheque,Y,Y,Y,40000,40000,3280,Payment Clear,Y,,,,,,,"Natural Hydrogel, Boovi Booster, Solar torch, Solar DC Fan",DONE,     ,,
5,Shri Kalyan Electricals ,Badri Narayan Meena,RJ,Jaipur,Malviya Nagar,"House No. 56, Gomati
 Colony,Jagatpura,
Jaipur 302017",9769532208,Vimal Sir,Namrata+Anishka,Jan,30/12/2022,40000,33898,CARD,Y,Y,Y,40000,40000,,Payment Clear,Y,Y,Y,,Y,Y,Y,"AV Solar Sprayer,/ Solar Torch/ ",DONE,,,
6,,Mr. Padma Reddy,TS,RangaReddy ,Nagarguda ,"NagarGuda Village, Shabad
Mandal, Ranga Reddy Dist.
TS 509217",9440435645,Pawan,Pawan+  Vishnu+Tarka,March,31/3/2023,25000,20500,UPI,Y,Y,Y,25000,25000,0,Payment Clear,Y,Y,,Y,Y,Y,Y,Solar Dc Fan/ Solar Torch/ Boovi Booster*2,DONE,,,
7, SMART FARMER SOLUTION PVT LTD,Mr. VIjaykumar Ramnath Somani,MH,JALGAON,Gandhinagar,"Shop No. 6, Avenue Complex,
Gandhi Nagar, Near RR School
Jalgaon 425001",9096459988,Anishka,Anishka+ Vimal Sir,March,31/3/2023,25000,20500,UPI,Y,Y,Y,25000,25000,,Payment Clear,Y,,,,Y,Y,Y,Solar Dc Fan/ Solar Torch/ Boovi Booster*2,DONE,"AVGG Organic Bioactive Fertilizer,
AVMK Sakal Samriddhi Olpn 1 L(10-50L),
AVOC Natural Immunity Cattle Supplement Rakshak 2 Kg ,",23 Sep 2024,2129